Course name,Campus,"Course code","Fee type", Duration,"Prev LSR","Avail INT"
Bachelor of Information Technology,City,603201,CSP,3F/6P,80.05,Y
Bachelor of Information Technology Dip Information Technology Professional Practice,City,603200,CSP,4F/8P,80.60,Y
Bachelor of Information Technology (Co-op),City,603210,CSP,3F,N/A,N
Bachelor of Information Technology Bachelor of Business,City,603220,CSP,4F,82.20,Y
Bachelor of Information Technology Bachelor of Creative Intelligence and Innovation,City,609565,CSP,4F,80.65,Y
Bachelor of Information Technology Bachelor of International Studies,City,609230,CSP,5F,90.10,Y
Bachelor of Information Technology Bachelor of Laws,City,609020,CSP,5F,96.35,Y
Bachelor of Landscape Architecture (Hons),City,602020,CSP,4F/EqP,78.15,Y
Bachelor of Laws,City,604000,CSP,4F,96.00,Y
Bachelor of Laws,City,604001,CSP,6.5P,N/A,N
Bachelor of Laws Bachelor of Creative Intelligence and Innovation,City,609575,CSP,4F,96.25,Y
Bachelor of Laws Bachelor of International Studies,City,609070,CSP,5F,96.20,Y
Bachelor of Management (Digital Creative Enterprise),City,601065,CSP,3F,82.00,Y
Bachelor of Management (Events),City,601068,CSP,3F,80.00,Y
Bachelor of Management (Events) Bachelor of Creative Intelligence and Innovation,City,609532,CSP,4F/8P,80.90,Y
Bachelor of Management (Sport Business),City,601070,CSP,3F,80.10,Y
Bachelor of Management (Sport Business) Bachelor of Creative Intelligence and Innovation,City,609533,CSP,4F/8P,80.00,Y
Bachelor of Management Bachelor of International Studies,City,609090,CSP,5F,80.75,Y
Bachelor of Management Bachelor of Sustainability and Environment,City,609801,CSP,4F,88.15,Y
Bachelor of Marine Biology and Climate Change,City,607035,CSP,3F/6P,79.50,Y
Bachelor of Mathematical Sciences,City,607081,CSP,3F,92.55,Y
Bachelor of Mathematical Sciences Bachelor of International Studies,City,609601,CSP,5F,N/A,Y
Bachelor of Medical Science (Medical and Health-related Sciences),City,607052,CSP,3F/6P,87.10,Y
Bachelor of Medical Science (Pathology),City,607051,CSP,3F/6P,83.55,Y
Bachelor of Medical Science Bachelor of Business,City,609175,CSP,4F/8P,90.40,Y
Bachelor of Medical Science Bachelor of International Studies,City,609255,CSP,5F,91.05,Y
Bachelor of Medical Science Bachelor of Laws,City,609065,CSP,5F,96.35,Y
Bachelor of Midwifery,City,606010,CSP,3F,91.55,N
Bachelor of Midwifery Bachelor of Creative Intelligence and Innovation,City,609570,CSP,4F,91.00,N
Bachelor of Molecular Biotechnology,City,607045,CSP,3F/6P,85.30,Y
Bachelor of Molecular Biotechnology Bachelor of Business,City,609176,CSP,4F/8P,91.50,Y
Bachelor of Music and Sound Design,City,600006,CSP,3F,70.15,Y
Bachelor of Music and Sound Design Bachelor of Creative Intelligence and Innovation,City,609490,CSP,4F,74.90,Y
Bachelor of Music and Sound Design Bachelor of International Studies,City,609296,CSP,5F,76.10,Y
Bachelor of Nursing,City,606000,CSP,3F,73.10,Y
Bachelor of Nursing,City,606001,CSP,6P,83.40,N
Bachelor of Nursing (Accelerated Program: Enrolled Nurse),City,606004,CSP,2F/4P,N/A,N


Bachelor of Nursing Bachelor of Creative Intelligence and Innovation,City,609568,CSP,4F,80.50,Y
Bachelor of Nursing Bachelor of International Studies,City,609150,CSP,5F,80.25,Y
Bachelor of Property Economics,City,602033,CSP,3F/EqP,80.25,Y
Bachelor of Property Economics Bachelor of International Studies,City,609200,CSP,5F/EqP,85.40,Y
Bachelor of Science (Biotechnology/Medical Science),City,607015,CSP,3F/6P,76.25,Y
Bachelor of Science (Chemistry),City,607005,CSP,3F/6P,74.10,Y
Bachelor of Science (Environmental Sciences),City,607011,CSP,3F/6P,73.75,Y
Bachelor of Science (Flexible),City,607001,CSP,3F/6P,75.95,Y
Bachelor of Science (Mathematics),City,607003,CSP,3F/6P,82.10,Y
Bachelor of Science (Physics),City,607009,CSP,3F/6P,72.15,Y
Bachelor of Science Bachelor of Business,City,609170,CSP,4F/8P,87.40,Y
Bachelor of Science Bachelor of Creative Intelligence and Innovation,City,609585,CSP,4F/8P,84.90,Y
Bachelor of Science Bachelor of International Studies,City,609250,CSP,5F,84.80,Y
Bachelor of Science Bachelor of Laws,City,609060,CSP,5F,96.75,Y
Bachelor of Science Bachelor of Sustainability and Environment,City,609803,CSP,4F,80.10,Y
Bachelor of Science Master of Teaching in Secondary Education (Biology, Chemistry and Environmental Science),City,600050,CSP,4F,76.30,Y
Bachelor of Science Master of Teaching in Secondary Education (Chemistry and Physics, Junior Mathematics),City,600052,CSP,4F,93.75,Y
Bachelor of Science Master of Teaching in Secondary Education (Mathematics and Mathematics/Physics),City,600053,CSP,4F,77.70,Y
Bachelor of Sport and Exercise Management,Moore Park,606030,CSP,3F,72.30,Y
Bachelor of Sport and Exercise Management Bachelor of International Studies,"City/Moore Park",609085,CSP,5F,87.00,Y
Bachelor of Sport and Exercise Science,Moore Park,606020,CSP,3F,83.05,Y
Bachelor of Sport and Exercise Science (Exercise Therapy),Moore Park,606021,CSP,3F,99.35,N
Bachelor of Sport and Exercise Science Bachelor of Creative Intelligence and Innovation,City,609580,CSP,4F,91.00,Y
Bachelor of Sport and Exercise Science Bachelor of International Studies,"City/Moore Park",609080,CSP,5F,86.45,Y
Bachelor of Technology (Advanced Manufacturing),City,603141,CSP,3F/6P,N/A,N
Bachelor of Technology (Flexible Engineering),City,603142,CSP,3F/6P,75.45,N
Bachelor of Technology Master of Teaching in Secondary Education (TAS – Computing/Mathematics),City,600063,CSP,4.5F,78.95,Y


Bachelor of Arts,UOW Wollongong,753101,CSP,3F/EqP,70.20,Y
Bachelor of Arts,UOW Shoalhaven,753102,CSP,3F/EqP,70.20,Y
Bachelor of Arts,UOW Eurobodalla,753106,CSP,3F/EqP,70.20,N
Bachelor of Arts,UOW Bega Valley,753107,CSP,3F/EqP,70.20,N
Bachelor of Arts,UOW Southern Highlands,753108,CSP,3F/EqP,70.20,N
Bachelor of Arts (Psychology),UOW Wollongong,753200,CSP,3F/EqP,75.05,Y
Bachelor of Arts (Psychology)/Bachelor of Business,UOW Wollongong,751228,CSP,4.5F/EqP,75.05,Y
Bachelor of Arts (Psychology)/Bachelor of Laws,UOW Wollongong,751200,CSP,5F/EqP,90.60,Y
Bachelor of Arts/Bachelor of Business,UOW Wollongong,751229,CSP,4.5F/EqP,75.35,Y
Bachelor of Arts/Bachelor of Communication and Media,UOW Wollongong,751350,CSP,4.5F/EqP,70.30,Y
Bachelor of Arts/Bachelor of International Studies,UOW Wollongong,751310,CSP,4.5F/EqP,73.00,Y
Bachelor of Arts/Bachelor of Laws,UOW Wollongong,751201,CSP,5F/EqP,90.60,Y
Bachelor of Business,UOW Wollongong,751237,CSP,3F/EqP,75.35,Y
Bachelor of Business,UOW Shoalhaven,751238,CSP,3F/EqP,74.25,N
Bachelor of Business,UOW Eurobodalla,751239,CSP,3F/EqP,74.25,N
Bachelor of Business,UOW Bega Valley,751240,CSP,3F/EqP,74.25,N
Bachelor of Business,UOW Southern Highlands,751241,CSP,3F/EqP,74.25,N
Bachelor of Business,UOW Sutherland,751242,CSP,3F/EqP,74.25,Y
Bachelor of Business,UOW Liverpool,751243,CSP,3F/EqP,75.35,Y
Bachelor of Business - TAFE Advanced Diploma of Event Management,UOW Wollongong,751275,CSP,3F/EqP,76.05,N
"Bachelor of Business - TAFE Advanced Diploma of Hospitality Management",UOW Wollongong,751276,CSP,3F/EqP,76.05,N
"Bachelor of Business - TAFE Advanced Diploma of Travel and Tourism Management",UOW Wollongong,751277,CSP,3F/EqP,76.05,N
Bachelor of Business Administration,UOW Wollongong,751261,CSP,3F/EqP,72.60,Y
Bachelor of Business Administration,UOW Liverpool,751262,CSP,3F/EqP,72.60,Y
Bachelor of Business Administration,UOW Shoalhaven,751263,CSP,3F/EqP,72.60,N
Bachelor of Business Administration,UOW Eurobodalla,751264,CSP,3F/EqP,72.60,N
Bachelor of Business Administration,UOW Bega Valley,751265,CSP,3F/EqP,72.60,N
Bachelor of Business Administration,UOW Southern Highlands,751266,CSP,3F/EqP,72.60,N
Bachelor of Business Administration,UOW Sutherland,751267,CSP,3F/EqP,72.60,Y
Bachelor of Business Administration/Bachelor of Information Technology,UOW Wollongong,751259,CSP,4.5F/EqP,76.30,Y
Bachelor of Business Administration/Bachelor of Information Technology,UOW Liverpool,751260,CSP,4.5F/EqP,76.30,Y


Bachelor of Business Information Systems,UOW Wollongong,754500,CSP,3F/EqP,75.65,Y
Bachelor of Business Information Systems,UOW Liverpool,754505,CSP,3F/EqP,75.65,Y
Bachelor of Business/Bachelor of Laws,UOW Wollongong,751251,CSP,5F/EqP,90.60,Y
Bachelor of Business/Bachelor of Laws,UOW Liverpool,751252,CSP,5F/EqP,90.60,Y
Bachelor of Business/Master of Business,UOW Wollongong,751319,CSP,4.5F/EqP,N/A,N
Bachelor of Business/Master of Business Analytics,UOW Wollongong,751322,CSP,4.5F/EqP,N/A,N
Bachelor of Communication and Media,UOW Wollongong,753110,CSP,3F/EqP,70.30,Y
Bachelor of Communication and Media/Bachelor of Business,UOW Wollongong,751254,CSP,4.5F/EqP,75.35,Y
Bachelor of Communication and Media/Bachelor of International Studies,UOW Wollongong,751354,CSP,4.5F/EqP,73.00,Y
Bachelor of Communication and Media/Bachelor of Laws,UOW Wollongong,751210,CSP,5F/EqP,90.60,Y
Bachelor of Computer Science,UOW Wollongong,754100,CSP,3F/EqP,75.75,Y
Bachelor of Computer Science,UOW Liverpool,754120,CSP,3F/EqP,75.75,Y
Bachelor of Computer Science (Cyber Security) - Cyber Academy,Distance,754130,CSP,3F,75.75,N
Bachelor of Computer Science (Dean's Scholar),UOW Wollongong,754110,CSP,3F/EqP,97.40,Y
Bachelor of Computer Science/Bachelor of Laws,UOW Wollongong,751203,CSP,6F/EqP,90.60,Y
Bachelor of Computer Science/Bachelor of Laws,UOW Liverpool,751222,CSP,6F/EqP,90.60,Y
Bachelor of Computer Science/Bachelor of Science,UOW Wollongong,751402,CSP,4.5F/EqP,75.75,Y
Bachelor of Conservation Biology (Honours),UOW Wollongong,757627,CSP,4F/EqP,80.45,Y
Bachelor of Creative Arts (Creative Writing),UOW Wollongong,754601,CSP,3F/EqP,71.35,Y
Bachelor of Creative Arts (Music),UOW Wollongong,754603,CSP,3F/EqP,71.35,Y
Bachelor of Creative Arts (Visual Arts and Design),UOW Wollongong,754607,CSP,3F/EqP,71.35,Y
Bachelor of Creative Arts (Visual Arts),UOW Wollongong,754605,CSP,3F/EqP,71.35,Y
Bachelor of Creative Arts/Bachelor of Arts,UOW Wollongong,751501,CSP,4.5F/EqP,71.35,Y
Bachelor of Creative Arts/Bachelor of Business,UOW Wollongong,751231,CSP,4.5F/EqP,75.35,Y
Bachelor of Creative Arts/Bachelor of Communication and Media,UOW Wollongong,751506,CSP,4.5F/EqP,70.30,Y
Bachelor of Creative Arts/Bachelor of Journalism,UOW Wollongong,751507,CSP,4.5F/EqP,73.05,Y
Bachelor of Creative Arts/Bachelor of Laws,UOW Wollongong,751204,CSP,5F/EqP,90.60,Y
Bachelor of Creative Arts/Bachelor of Science,UOW Wollongong,751504,CSP,4.5F/EqP,70.20,Y
Bachelor of Data Science and Analytics,UOW Wollongong,756522,CSP,3F/EqP,88.90,Y
Bachelor of Economics and Finance,UOW Wollongong,753670,CSP,3F/EqP,81.00,Y
Bachelor of Economics and Finance,UOW Shoalhaven,753671,CSP,3F/EqP,81.00,N
Bachelor of Economics and Finance,UOW Eurobodalla,753672,CSP,3F/EqP,81.00,N
Bachelor of Economics and Finance,UOW Bega Valley,753673,CSP,3F/EqP,81.00,N
Bachelor of Economics and Finance,UOW Southern Highlands,753674,CSP,3F/EqP,81.00,N
Bachelor of Economics and Finance,UOW Sutherland,753675,CSP,3F/EqP,81.00,Y
Bachelor of Economics and Finance/Bachelor of Laws,UOW Wollongong,751216,CSP,5.5F/EqP,90.60,Y
Bachelor of Economics and Finance/Master of Business,UOW Wollongong,751323,CSP,4.5F/EqP,N/A,N
Bachelor of Economics and Finance/Master of Business Analytics,UOW Wollongong,751324,CSP,4.5F/EqP,N/A,N
Bachelor of Education – The Early Years,UOW Wollongong,755113,CSP,4F/EqP,71.10,Y
Bachelor of Education – The Early Years (Flexible),UOW Wollongong,755111,CSP,4F/EqP,71.10,N
Bachelor of Engineering (Honours) (Architectural),UOW Wollongong,755609,CSP,4F/EqP,80.00,Y
Bachelor of Engineering (Honours) (Biomedical),UOW Wollongong,755610,CSP,4F/EqP,80.00,Y
Bachelor of Engineering (Honours) (Civil),UOW Wollongong,755611,CSP,4F/EqP,80.00,Y
"Bachelor of Engineering (Honours) (Computer and Autonomous Systems)",UOW Wollongong,755621,CSP,4F/EqP,80.00,Y
Bachelor of Engineering (Honours) (Electrical and Electronics),UOW Wollongong,755622,CSP,4F/EqP,80.00,Y
Bachelor of Engineering (Honours) (Environmental),UOW Wollongong,755612,CSP,4F/EqP,80.00,Y


Bachelor of Engineering (Honours) (Flexible First Year),UOW Wollongong,755624,CSP,4F/EqP,80.00,Y
Bachelor of Engineering (Honours) (Materials),UOW Wollongong,755613,CSP,4F/EqP,80.00,Y
"Bachelor of Engineering (Honours) (Mechanical or Mechatronic)/
Bachelor of Exercise Science",UOW Wollongong,751625,CSP,5.5F/EqP,80.00,Y
Bachelor of Engineering (Honours) (Mechanical),UOW Wollongong,755614,CSP,4F/EqP,80.00,Y
Bachelor of Engineering (Honours) (Mechatronic),UOW Wollongong,755616,CSP,4F/EqP,80.00,Y
Bachelor of Engineering (Honours) (Mining),UOW Wollongong,755615,CSP,4F/EqP,80.00,Y
Bachelor of Engineering (Honours) (Scholar),UOW Wollongong,755601,CSP,4F/EqP,97.40,Y
"Bachelor of Engineering (Honours) (Telecommunications Engineering and Internet of Things)",UOW Wollongong,755623,CSP,4F/EqP,80.00,Y
Bachelor of Engineering (Honours)/Bachelor of Arts,UOW Wollongong,751302,CSP,5.5F/EqP,80.00,Y
Bachelor of Engineering (Honours)/Bachelor of Business,UOW Wollongong,751258,CSP,5.5F/EqP,80.00,Y
Bachelor of Engineering (Honours)/Bachelor of Computer Science,UOW Wollongong,751609,CSP,5.5F/EqP,80.00,Y
Bachelor of Engineering (Honours)/Bachelor of Laws,UOW Wollongong,751208,CSP,7F/EqP,90.60,Y
Bachelor of Engineering (Honours)/Bachelor of Mathematics,UOW Wollongong,751610,CSP,5.5F/EqP,80.00,Y
Bachelor of Engineering (Honours)/Bachelor of Science,UOW Wollongong,751624,CSP,5.5F/EqP,80.00,Y
Bachelor of Engineering (Honours)/Bachelor of Science (Physics),UOW Wollongong,751623,CSP,5.5F/EqP,80.00,Y
Bachelor of Environmental Science (Honours),UOW Wollongong,757612,CSP,4F/EqP,80.45,Y
Bachelor of Exercise Science,UOW Wollongong,757642,CSP,3F/EqP,75.00,Y
Bachelor of Exercise Science and Rehabilitation,UOW Wollongong,757643,CSP,4F/EqP,91.30,Y
Bachelor of Geography,UOW Wollongong,755250,CSP,3F/EqP,79.30,Y
Bachelor of Health and Physical Education,UOW Wollongong,755101,CSP,4F/EqP,76.05,Y
Bachelor of Information Technology,UOW Wollongong,754300,CSP,3F/EqP,76.30,Y
Bachelor of Information Technology,UOW Liverpool,754305,CSP,3F/EqP,76.30,Y
Bachelor of Information Technology (Dean's Scholar),UOW Wollongong,754310,CSP,3F/EqP,97.40,Y
Bachelor of Information Technology/Bachelor of Laws,UOW Wollongong,751213,CSP,5.5F/EqP,90.60,Y
Bachelor of Information Technology/Bachelor of Laws,UOW Liverpool,751223,CSP,5.5F/EqP,90.60,Y
Bachelor of International Studies,UOW Wollongong,753121,CSP,3F/EqP,73.00,Y
Bachelor of International Studies,UOW Liverpool,753123,CSP,3F/EqP,73.00,Y
Bachelor of International Studies/Bachelor of Business,UOW Wollongong,751232,CSP,4.5F/EqP,75.35,Y
Bachelor of International Studies/Bachelor of Business,UOW Liverpool,751233,CSP,4.5F/EqP,75.35,Y
Bachelor of International Studies/Bachelor of Laws,UOW Wollongong,751212,CSP,5F/EqP,90.60,Y
Bachelor of International Studies/Bachelor of Laws,UOW Liverpool,751224,CSP,5F/EqP,90.60,Y
Bachelor of Journalism,UOW Wollongong,754700,CSP,3F/EqP,73.05,Y
Bachelor of Journalism/Bachelor of Arts,UOW Wollongong,751660,CSP,4.5F/EqP,73.05,Y
Bachelor of Journalism/Bachelor of Communication and Media,UOW Wollongong,751664,CSP,4.5F/EqP,73.05,Y
Bachelor of Journalism/Bachelor of International Studies,UOW Wollongong,751666,CSP,4.5F/EqP,73.00,Y
Bachelor of Journalism/Bachelor of Laws,UOW Wollongong,751211,CSP,5F/EqP,90.60,Y
Bachelor of Journalism/Bachelor of Science,UOW Wollongong,751663,CSP,4.5F/EqP,70.20,Y
Bachelor of Laws (Direct Entry),UOW Wollongong,756100,CSP,4F/EqP,96.45,Y
Bachelor of Laws (Direct Entry),UOW Liverpool,756110,CSP,4F/EqP,96.45,Y
Bachelor of Laws (Graduate Entry),UOW Wollongong,756101,CSP,3F/EqP,N/A,N
Bachelor of Laws (Graduate Entry),UOW Liverpool,756111,CSP,3F/EqP,N/A,N
Bachelor of Laws (Graduate Entry),UOW Sydney CBD,756120,CSP,3F/EqP,N/A,N
Bachelor of Marine Science,UOW Wollongong,757622,CSP,3F/EqP,new,Y
Bachelor of Mathematics,UOW Wollongong,756511,CSP,3F/EqP,85.85,Y
Bachelor of Mathematics Advanced,UOW Wollongong,756512,CSP,3F/EqP,N/A,Y
Bachelor of Mathematics and Finance (Honours),UOW Wollongong,756503,CSP,4F/EqP,87.85,Y


Bachelor of Mathematics and Finance (Honours) (Dean's Scholar),UOW Wollongong,756520,CSP,4F/EqP,97.40,Y
Bachelor of Mathematics Education,UOW Wollongong,755102,CSP,4F/EqP,96.10,Y
Bachelor of Mathematics/Bachelor of Computer Science,UOW Wollongong,751701,CSP,4.5F/EqP,75.75,Y
Bachelor of Mathematics/Bachelor of Laws,UOW Wollongong,751206,CSP,5F/EqP,90.60,Y
Bachelor of Mathematics/Bachelor of Science (Physics),UOW Wollongong,751805,CSP,4.5F/EqP,N/A,Y
Bachelor of Medical and Health Sciences,UOW Wollongong,757630,CSP,3F/EqP,75.80,Y
Bachelor of Medical and Health Sciences (Honours) (Dean's Scholar),UOW Wollongong,757631,CSP,4F/EqP,97.00,Y
Bachelor of Medical and Radiation Physics,UOW Wollongong,757616,CSP,3F/EqP,80.45,Y
Bachelor of Medical and Radiation Physics Advanced Honours,UOW Wollongong,757603,CSP,4F/EqP,95.50,Y
Bachelor of Medical Biotechnology (Honours),UOW Wollongong,757611,CSP,4F/EqP,80.45,Y
Bachelor of Medicinal Chemistry (Honours),UOW Wollongong,757613,CSP,4F/EqP,80.45,Y
Bachelor of Neuroscience,UOW Wollongong,753240,CSP,3F/EqP,90.30,Y
Bachelor of Nursing,UOW Wollongong,757101,CSP,3F,65.10,Y
Bachelor of Nursing,UOW Bega Valley,757102,CSP,3F,65.10,Y
Bachelor of Nursing,UOW Shoalhaven,757103,CSP,3F,65.10,Y
Bachelor of Nursing,UOW Sutherland,757104,CSP,3F,65.10,N
Bachelor of Nursing,UOW Eurobodalla,757105,CSP,3F,65.10,Y
Bachelor of Nursing,UOW Liverpool,757106,CSP,3F,65.10,Y
Bachelor of Nursing (Enrolled Nurses-Dip Nursing Entry),UOW Wollongong,757111,CSP,2F,N/A,N
Bachelor of Nursing (Enrolled Nurses-Dip Nursing Entry),UOW Bega Valley,757112,CSP,2F,N/A,N
Bachelor of Nursing (Enrolled Nurses-Dip Nursing Entry),UOW Shoalhaven,757113,CSP,2F,N/A,N
Bachelor of Nursing (Enrolled Nurses-Dip Nursing Entry),UOW Sutherland,757114,CSP,2F,N/A,N
Bachelor of Nursing (Enrolled Nurses-Dip Nursing Entry),UOW Eurobodalla,757115,CSP,2F,N/A,N
Bachelor of Nursing (Enrolled Nurses-Dip Nursing Entry),UOW Liverpool,757116,CSP,2F,N/A,N
Bachelor of Nutrition and Dietetics (Honours),UOW Wollongong,757647,CSP,4F/EqP,91.60,Y
Bachelor of Nutrition Science,UOW Wollongong,757645,CSP,3F/EqP,75.75,Y
Bachelor of Performance and Theatre (Acting),UOW Wollongong,754820,CSP,3F/EqP,70.05,Y
Bachelor of Performance and Theatre (Theatre Making),UOW Wollongong,754825,CSP,3F/EqP,70.05,Y
Bachelor of Politics Philosophy and Economics/Bachelor of Laws,UOW Wollongong,751217,CSP,5.5F/EqP,90.60,Y
"Bachelor of Politics, Philosophy and Economics",UOW Wollongong,753115,CSP,3F/EqP,75.60,Y
"Bachelor of Pre-Medicine, Science and Health",UOW Wollongong,757500,CSP,3F/EqP,90.55,Y
Bachelor of Primary Education,UOW Wollongong,755112,CSP,4F/EqP,76.75,Y
Bachelor of Primary Education/Master of Autism,UOW Wollongong,751290,CSP,5.5F/EqP,93.15,N
Bachelor of Psychological Science,UOW Wollongong,753220,CSP,3F/EqP,76.10,Y
Bachelor of Psychological Science (Pathway to Primary Education),UOW Wollongong,753225,CSP,3F/EqP,76.10,Y
Bachelor of Psychological Science/Bachelor of Business,UOW Wollongong,751227,CSP,4.5F/EqP,76.10,Y
Bachelor of Psychological Science/Bachelor of Laws,UOW Wollongong,751215,CSP,5F/EqP,90.60,Y
Bachelor of Psychological Science/Bachelor of Neuroscience,UOW Wollongong,751755,CSP,5F/EqP,90.30,Y
Bachelor of Psychological Science/Bachelor of Social Science,UOW Wollongong,751761,CSP,4.5F/EqP,76.10,Y
"Bachelor of Psychological Science/Bachelor of Social Science (Criminology)",UOW Wollongong,751760,CSP,4.5F/EqP,76.10,Y
Bachelor of Psychology (Honours),UOW Wollongong,753230,CSP,4F/EqP,89.15,Y
Bachelor of Psychology (Honours)/Bachelor of Business,UOW Wollongong,751256,CSP,5.5F/EqP,89.15,Y
Bachelor of Public Health,UOW Wollongong,757650,CSP,3F/EqP,N/A,Y
Bachelor of Science,UOW Wollongong,757621,CSP,3F/EqP,70.20,Y
Bachelor of Science (Atmospheric Science),UOW Wollongong,757660,CSP,3F/EqP,84.00,Y
Bachelor of Science (Biomolecular Physics),UOW Wollongong,757661,CSP,3F/EqP,84.00,Y


Bachelor of Science (Honours) (Dean's Scholar),UOW Wollongong,757601,CSP,4F/EqP,97.00,Y
Bachelor of Science (Human Geography or Environment and Heritage Management),UOW Wollongong,757710,CSP,3F/EqP,80.60,Y
Bachelor of Science (Nuclear and Space Radiation Technology),UOW Wollongong,757633,CSP,3F/EqP,84.00,Y
Bachelor of Science (Physics and Mathematics),UOW Wollongong,757662,CSP,3F/EqP,84.00,Y
Bachelor of Science (Physics),UOW Wollongong,757637,CSP,3F/EqP,84.00,Y
Bachelor of Science (Physics)/Bachelor of Arts,UOW Wollongong,751803,CSP,4.5F/EqP,84.00,Y
Bachelor of Science Advanced Honours (Atmospheric Science),UOW Wollongong,757608,CSP,4F/EqP,95.50,Y
Bachelor of Science Advanced Honours (Biomolecular Physics),UOW Wollongong,757609,CSP,4F/EqP,95.50,Y
Bachelor of Science Advanced Honours (Physics),UOW Wollongong,757602,CSP,4F/EqP,95.50,Y
Bachelor of Science Education,UOW Wollongong,755103,CSP,4F/EqP,89.70,Y
Bachelor of Science/Bachelor of Arts,UOW Wollongong,751801,CSP,4.5F/EqP,70.20,Y
Bachelor of Science/Bachelor of Business,UOW Wollongong,751257,CSP,4.5F/EqP,75.35,Y
Bachelor of Science/Bachelor of Laws,UOW Wollongong,751207,CSP,5F/EqP,90.60,Y
Bachelor of Social Science,UOW Wollongong,755300,CSP,3F/EqP,71.25,Y
Bachelor of Social Science,UOW Shoalhaven,755301,CSP,3F/EqP,71.25,Y
Bachelor of Social Science (Criminology)/Bachelor Laws,UOW Wollongong,751219,CSP,5F/EqP,90.60,Y
Bachelor of Social Science (Pathway to Primary Education),UOW Wollongong,755305,CSP,3F/EqP,71.25,Y
Bachelor of Social Work,UOW Wollongong,755340,CSP,4F/EqP,81.60,Y
Bachelor of Social Work,UOW Shoalhaven,755341,CSP,4F/EqP,81.60,Y
Bachelor of Sport,UOW Wollongong,755100,CSP,3F/EqP,72.50,Y
Bachelor of Sustainable Communities,UOW Wollongong,755255,CSP,3F/EqP,96.90,Y
Bachelor of Technology,UOW Wollongong,754550,CSP,3F/EqP,70.80,Y
Diploma of Arts, Social Science and Humanities,UOW Wollongong,759610,CSP,1F/EqP,33.35,N
Diploma of Arts, Social Science and Humanities Fast Track,UOW Wollongong,759625,CSP,0.7F/EqP,47.15,N
Diploma of Arts, Social Science and Humanities Fast Track/Bachelor of Arts,UOW Wollongong,758001,CSP,3F/EqP,47.15,N
Diploma of Arts, Social Science and Humanities Fast Track/Bachelor of Communication and Media,UOW Wollongong,758002,CSP,3.7F/EqP,47.15,N
Diploma of Arts, Social Science and Humanities Fast Track/Bachelor of Creative Arts,UOW Wollongong,758003,CSP,3.7F/EqP,47.15,N
Diploma of Arts, Social Science and Humanities Fast Track/Bachelor of International Studies,UOW Wollongong,758004,CSP,3.7F/EqP,47.15,N
Diploma of Arts, Social Science and Humanities Fast Track/Bachelor of Psychological Science - Bachelor of Social Science,UOW Wollongong,758005,CSP,5.2F/EqP,47.15,N
Diploma of Arts, Social Science and Humanities Fast Track/Bachelor of Public Health,UOW Wollongong,758006,CSP,3.7F/EqP,47.15,N
Diploma of Arts, Social Science and Humanities Fast Track/Bachelor of Social Science,UOW Wollongong,758007,CSP,3F/EqP,47.15,N
Diploma of Arts, Social Science and Humanities Fast Track/Bachelor of Social Work,UOW Wollongong,758008,CSP,4.7F/EqP,47.15,N
Diploma of Arts, Social Science and Humanities/Bachelor of Arts,UOW Wollongong,758021,CSP,3F/EqP,33.35,N
Diploma of Arts, Social Science and Humanities/Bachelor of Communication and Media,UOW Wollongong,758022,CSP,4F/EqP,33.35,N
Diploma of Arts, Social Science and Humanities/Bachelor of Creative Arts,UOW Wollongong,758023,CSP,4F/EqP,33.35,N
Diploma of Arts, Social Science and Humanities/Bachelor of International Studies,UOW Wollongong,758024,CSP,4F/EqP,33.35,N
Diploma of Arts, Social Science and Humanities/Bachelor of Psychological Science – Bachelor of Social Science,UOW Wollongong,758025,CSP,5.5F/EqP,33.35,N
Diploma of Arts, Social Science and Humanities/Bachelor of Public Health,UOW Wollongong,758026,CSP,4F/EqP,33.35,N


"Diploma of Arts, Social Science and Humanities/Bachelor of Social Science",UOW Wollongong,758027,CSP,3F/EqP,33.35,N
"Diploma of Arts, Social Science and Humanities/Bachelor of Social Work",UOW Wollongong,758028,CSP,5F/EqP,33.35,N
Diploma of Business,UOW Wollongong,759590,CSP,1F/EqP,31.35,Y
Diploma of Business,UOW Liverpool,759595,CSP,1F/EqP,31.35,Y
Diploma of Business Fast Track,UOW Wollongong,759030,CSP,0.7F/EqP,46.60,Y
Diploma of Business Fast Track,UOW Liverpool,759035,CSP,0.7F/EqP,46.60,Y
Diploma of Business Fast Track/Bachelor of Business,UOW Wollongong,758031,CSP,3F/EqP,45.40,N
Diploma of Business Fast Track/Bachelor of Business,UOW Liverpool,758034,CSP,3F/EqP,45.40,N
Diploma of Business Fast Track/Bachelor of Business Administration,UOW Wollongong,758032,CSP,3F/EqP,45.40,N
Diploma of Business Fast Track/Bachelor of Business Administration,UOW Liverpool,758035,CSP,3F/EqP,45.40,N
Diploma of Business/Bachelor of Business,UOW Wollongong,758041,CSP,3F/EqP,41.30,N
Diploma of Business/Bachelor of Business,UOW Liverpool,758044,CSP,3F/EqP,41.30,N
Diploma of Business/Bachelor of Business Administration,UOW Wollongong,758042,CSP,3F/EqP,41.30,N
Diploma of Business/Bachelor of Business Administration,UOW Liverpool,758045,CSP,3F/EqP,41.30,N
Diploma of Engineering,UOW Wollongong,759630,CSP,1.5F/EqP,43.25,Y
Diploma of Engineering Fast Track,UOW Wollongong,759050,CSP,0.7F/EqP,60.55,Y
"Diploma of Engineering Fast Track/Bachelor of Engineering (Honours) (Flexible First Year)",UOW Wollongong,758051,CSP,4F/EqP,60.55,N
"Diploma of Engineering/Bachelor of Engineering (Honours) (Flexible First Year)",UOW Wollongong,758053,CSP,4.5F/EqP,43.25,N
Diploma of Information Technology,UOW Wollongong,759600,CSP,1F/EqP,36.10,Y
Diploma of Information Technology,UOW Liverpool,759605,CSP,1F/EqP,36.10,Y
Diploma of Information Technology Fast Track,UOW Wollongong,759010,CSP,0.7F/EqP,55.15,Y
Diploma of Information Technology Fast Track,UOW Liverpool,759015,CSP,0.7F/EqP,55.15,Y
"Diploma of Information Technology Fast Track/ Bachelor of Business Information Systems",UOW Liverpool,758066,CSP,3F/EqP,55.15,N
"Diploma of Information Technology Fast Track/Bachelor of Business Information Systems",UOW Wollongong,758061,CSP,3F/EqP,55.15,N
"Diploma of Information Technology Fast Track/Bachelor of Computer Science",UOW Wollongong,758062,CSP,3F/EqP,55.15,N
